{
  "$schema": "./registry.lock.schema.json",
  "schemaVersion": 1,
  "registry": "https://github.com/neko233-com/ihub/blob/main/plugins/registry.json",
  "lockState": "resolved",
  "generatedAt": "2026-08-02T09:01:52.924Z",
  "packages": [
    {
      "id": "ihub-plugin-ocr",
      "source": {
        "url": "https://github.com/neko233-com/ihub-plugin-ocr",
        "requestedRef": "v0.2.1"
      },
      "resolved": {
        "commit": "b4e927c08485bc171e0d1f9c799ad4939d8127b5",
        "version": "0.2.1"
      },
      "integrity": {
        "manifestSha256": "70eed45befae46f8b16f22cb20dcfd3643a083f07b4e4c8f3acbdb79f3f3d537",
        "artifacts": [
          {
            "target": "web",
            "path": "dist/index.html",
            "sha256": "eca1af2282fbfa1198e8ba42a12b4e2363a1c51319dc0e1d154b40667e9bb213"
          },
          {
            "target": "web",
            "path": "dist/main.js",
            "sha256": "c8a3f838f59dc2800a7594602bfe74c09a964dba64b2d53876768b572e66961e"
          },
          {
            "target": "web",
            "path": "dist/style.css",
            "sha256": "a491751da86c05b206f29a22d4cd3477dc7407788050f02e07cce1a23dd814a1"
          },
          {
            "target": "windows-x86_64",
            "path": "bin/windows-x86_64/ocr-worker.exe",
            "sha256": "945714f08e8f98dcd34ed1708cf74a8244c38a25e6911aa4dac547f7581c8a9b"
          }
        ]
      },
      "permissions": {
        "filesystem": {
          "read": [
            "user-selected"
          ]
        },
        "clipboard": {
          "write": true
        },
        "nativeApi": true,
        "launcherContext": {
          "files": true,
          "image": true
        }
      },
      "verified": true,
      "note": "Published v0.2.1. Launcher file/image handoff contains bounded metadata only; the user must still select a PNG/JPG/JPEG grant before the hash-locked Windows OCR worker runs. Cross-host release checks validate the PE statically, while Windows also rebuilds and executes its RPC probes. No network or background scan is available."
    },
    {
      "id": "ihub-plugin-translate",
      "source": {
        "url": "https://github.com/neko233-com/ihub-plugin-translate",
        "requestedRef": "v1.1.0"
      },
      "resolved": {
        "commit": "e54b96d5c6ee1555f41e5750a34ef4d6e2580baf",
        "version": "1.1.0"
      },
      "integrity": {
        "manifestSha256": "ab51c452fc88249cc0c4fffb553a4602f180b479ce1c3b9976ac3c1f66eeeba2",
        "artifacts": [
          {
            "target": "web",
            "path": "dist/index.html",
            "sha256": "10dea2a4ae781c9f4254ade40f6a58c84d4ab88cf98eee31204c8c31e74ce63c"
          },
          {
            "target": "web",
            "path": "dist/main.js",
            "sha256": "5fae4a8ba27dc55700aaaf99904057f0f6669d580dd0b416ac497214e3a99438"
          }
        ]
      },
      "permissions": {
        "network": {
          "allow": [
            "user-configured HTTPS LibreTranslate-compatible endpoint"
          ]
        },
        "clipboard": {
          "write": true
        },
        "launcherContext": {
          "text": true
        }
      },
      "verified": true,
      "note": "Published v1.1.0. Explicit launcher text is consumed once and only prefilled; translation occurs only after the user supplies an HTTPS LibreTranslate-compatible endpoint and clicks Translate. The optional API key remains session-only."
    },
    {
      "id": "ihub-plugin-colorpick",
      "source": {
        "url": "https://github.com/neko233-com/ihub-plugin-colorpick",
        "requestedRef": "v1.1.0"
      },
      "resolved": {
        "commit": "9dda181fab44f4fd1d0b5be4d5fe1c10c299befe",
        "version": "1.1.0"
      },
      "integrity": {
        "manifestSha256": "536f487bdbaa42288a4d89b4b8a2db48d7727d1265ec06fa72e4073d39d5521c",
        "artifacts": [
          {
            "target": "web",
            "path": "dist/index.html",
            "sha256": "bc061bd9cc7bd393245c6333a1d4d9c736dd257791519b5c3993c58d10c4e9eb"
          },
          {
            "target": "web",
            "path": "dist/main.js",
            "sha256": "56ad469113bcffc88ad99dc4cdd4bd6f8edfd5ccf9e3eaca844f564ce2bf90bb"
          }
        ]
      },
      "permissions": {
        "clipboard": {
          "write": true
        },
        "cursorColor": true
      },
      "verified": true,
      "note": "Published v1.1.0. Each native cursor-color sample requires a visible click and separate iHub confirmation, returns only HEX/RGB, and exposes no coordinates, screenshot, recording, or background polling."
    },
    {
      "id": "ihub-plugin-clipboard",
      "source": {
        "url": "https://github.com/neko233-com/ihub-plugin-clipboard",
        "requestedRef": "v1.0.1"
      },
      "resolved": {
        "commit": "8158cfd4bdddbf6065c881d986f3ac72422d15e0",
        "version": "1.0.1"
      },
      "integrity": {
        "manifestSha256": "d6c353e5436c12e5426ce97d8c5b00c0237c6801f72291e128d00acf30e559b5",
        "artifacts": [
          {
            "target": "web",
            "path": "dist/index.html",
            "sha256": "e5e90f85264f58f5d558aabf3564db768c0fa1860c3b36576347b8899161939d"
          },
          {
            "target": "web",
            "path": "dist/main.js",
            "sha256": "a67eba9934a7006140b8dda193588d7ed05007d5dab1894973e8b4c4df71531f"
          },
          {
            "target": "web",
            "path": "dist/style.css",
            "sha256": "834522f477138e4a148aca48659678da06c80c33f54fa4fe173807886e6a199d"
          }
        ]
      },
      "permissions": {
        "clipboard": {
          "read": true,
          "write": true,
          "history": true
        }
      },
      "verified": true,
      "note": "Published v1.0.1 source tag. Commit and manifest/frontend SHA-256 values were verified from a clean standalone clone with raw tag equality; current clipboard text is read only after user capture, and the separately granted history snapshot is read-only, bounded, and user-invoked. No native artifacts or publisher signature are present."
    },
    {
      "id": "ihub-plugin-screenshot",
      "source": {
        "url": "https://github.com/neko233-com/ihub-plugin-screenshot",
        "requestedRef": "v1.0.1"
      },
      "resolved": {
        "commit": "11ab0cfbb279523337a82066469a7786070bc42b",
        "version": "1.0.1"
      },
      "integrity": {
        "manifestSha256": "c5466cb8c265769cbd1e11ed8d6c624de8ab64874a232466502b0f50060e0862",
        "artifacts": [
          {
            "target": "web",
            "path": "dist/index.html",
            "sha256": "65e57ee969b6aacecc8f4f6d910d7424df8d382d66690221d9723b69827b40c9"
          },
          {
            "target": "web",
            "path": "dist/main.js",
            "sha256": "fa9eb2f8f897cbf24e6dfbc165c3ad4dc29f823d9d0d709f4104b41a569a36c0"
          }
        ]
      },
      "permissions": {
        "screenCapture": true,
        "clipboard": {
          "write": true
        }
      },
      "verified": true,
      "note": "Published v1.0.1 source tag. Commit and manifest/frontend SHA-256 values were verified from raw GitHub contents and a clean standalone clone. The plugin asks the browser for user-selected getDisplayMedia sharing only after a click, takes one frame to a local PNG preview, and can write a confirmed result to the clipboard. screenCapture only grants a short-lived focus lease around the browser picker; it provides no screen pixels, native capture, filesystem access, background capture, or global hotkey. autoUpdate permits host-led stable update checks, while applying an update remains user-confirmed. No native artifacts or publisher signature are present."
    },
    {
      "id": "ihub-plugin-image-tools",
      "source": {
        "url": "https://github.com/neko233-com/ihub-plugin-image-tools",
        "requestedRef": "v1.1.0"
      },
      "resolved": {
        "commit": "663b88540cc73cb83e0070d0462c450198386bb1",
        "version": "1.1.0"
      },
      "integrity": {
        "manifestSha256": "e643e33b95c824b520973f158121c43f1d7c2e0b3e9c568a0813102714368656",
        "artifacts": [
          {
            "target": "web",
            "path": "dist/index.html",
            "sha256": "ebe8ca9297b3a4d0dbdd53bdac07f55a68f0ccdbeb5a573b4bbb90949378e7b1"
          },
          {
            "target": "web",
            "path": "dist/main.js",
            "sha256": "980f7926422a8b7995a5762b69f30f420f0dd90948373dc652ed8e68c8d36242"
          },
          {
            "target": "web",
            "path": "dist/style.css",
            "sha256": "48489e1bac019cdb3b6d7798f3976eb24fe71a5605f3c75b1078661d0b43e622"
          }
        ]
      },
      "permissions": {
        "launcherContext": {
          "files": true,
          "image": true
        }
      },
      "verified": true,
      "note": "Published v1.1.0. Launcher file/image handoff contains metadata only; pixels are processed locally only after explicit file selection or drop. The plugin has no network, arbitrary filesystem, clipboard, or native capability."
    },
    {
      "id": "ihub-plugin-json-tools",
      "source": {
        "url": "https://github.com/neko233-com/ihub-plugin-json-tools",
        "requestedRef": "v1.0.1"
      },
      "resolved": {
        "commit": "584899b8aaa3c2ed1d6397c182a1ab75ded763cd",
        "version": "1.0.1"
      },
      "integrity": {
        "manifestSha256": "43fc4d2512a97b062f112fd3ea023e6c4208d8c5c90ba4b1302c2403dff4ee9e",
        "artifacts": [
          {
            "target": "web",
            "path": "dist/index.html",
            "sha256": "5263e23ebb8613d2dec1b8fe7830426c64b874a7b6c300f03aed4a19187b42df"
          },
          {
            "target": "web",
            "path": "dist/main.js",
            "sha256": "d87259426703964d7a42d6fb3747dc428cfbc890deaded830b8784c80d86c150"
          }